{
  "dataset": "d365-finops-pqu",
  "schema_version": "1.1.0",
  "pipeline_revision": "2.0.0",
  "generated_at": "2026-10-15T04:35:05.363122Z",
  "first_published_at": "2026-09-24T12:00:00Z",
  "last_published_at": "2026-10-15T04:35:05.363122Z",
  "record_count": 59,
  "station_schedule_count": 30,
  "region_count": 31,
  "service_update_count": 9,
  "maintenance_window_count": 15,
  "status_counts": {
    "Completed": 25,
    "Canceled": 1,
    "In-Progress": 5,
    "Not Started": 28
  },
  "current_count": 5,
  "upcoming_count": 28,
  "latest_pqu_id": "10.0.49-PQU-1",
  "check_interval_minutes": 60,
  "source": {
    "publisher": "Microsoft",
    "repository": "MicrosoftDocs/dynamics-365-unified-operations-public",
    "branch": "main",
    "file_path": "articles/fin-ops-core/dev-itpro/get-started/quality-updates-schedule.md",
    "commit": "7d86a35169692606d303c21e204ae6032d44d44e",
    "article_url": "https://learn.microsoft.com/en-us/dynamics365/fin-ops-core/dev-itpro/get-started/quality-updates-schedule",
    "raw_url": "https://raw.githubusercontent.com/MicrosoftDocs/dynamics-365-unified-operations-public/7d86a35169692606d303c21e204ae6032d44d44e/articles/fin-ops-core/dev-itpro/get-started/quality-updates-schedule.md",
    "markdown_date": "2026-10-13",
    "sha256": "8431bf5fb97becf088a0eaa4eec8f42cb7f86dcafc7f68f9d4b3d972b5cf1eb0",
    "retrieved_at": "2026-10-13T13:44:17.669863Z"
  },
  "sources": {
    "schedule": {
      "label": "Release schedule for proactive quality updates",
      "required": true,
      "article_url": "https://learn.microsoft.com/en-us/dynamics365/fin-ops-core/dev-itpro/get-started/quality-updates-schedule",
      "file_path": "articles/fin-ops-core/dev-itpro/get-started/quality-updates-schedule.md",
      "state": "current",
      "source": {
        "publisher": "Microsoft",
        "repository": "MicrosoftDocs/dynamics-365-unified-operations-public",
        "branch": "main",
        "file_path": "articles/fin-ops-core/dev-itpro/get-started/quality-updates-schedule.md",
        "commit": "7d86a35169692606d303c21e204ae6032d44d44e",
        "article_url": "https://learn.microsoft.com/en-us/dynamics365/fin-ops-core/dev-itpro/get-started/quality-updates-schedule",
        "raw_url": "https://raw.githubusercontent.com/MicrosoftDocs/dynamics-365-unified-operations-public/7d86a35169692606d303c21e204ae6032d44d44e/articles/fin-ops-core/dev-itpro/get-started/quality-updates-schedule.md",
        "markdown_date": "2026-10-13",
        "sha256": "8431bf5fb97becf088a0eaa4eec8f42cb7f86dcafc7f68f9d4b3d972b5cf1eb0",
        "retrieved_at": "2026-10-13T13:44:17.669863Z"
      }
    },
    "service_updates": {
      "label": "Service update availability",
      "required": false,
      "article_url": "https://learn.microsoft.com/en-us/dynamics365/fin-ops-core/dev-itpro/get-started/public-preview-releases",
      "file_path": "articles/fin-ops-core/dev-itpro/get-started/public-preview-releases.md",
      "state": "stale",
      "source": {
        "publisher": "Microsoft",
        "repository": "MicrosoftDocs/dynamics-365-unified-operations-public",
        "branch": "main",
        "file_path": "articles/fin-ops-core/dev-itpro/get-started/public-preview-releases.md",
        "commit": "b348d48184186e3244de6aae50a1377c5718789f",
        "article_url": "https://learn.microsoft.com/en-us/dynamics365/fin-ops-core/dev-itpro/get-started/public-preview-releases",
        "raw_url": "https://raw.githubusercontent.com/MicrosoftDocs/dynamics-365-unified-operations-public/b348d48184186e3244de6aae50a1377c5718789f/articles/fin-ops-core/dev-itpro/get-started/public-preview-releases.md",
        "markdown_date": "2026-06-04",
        "sha256": "05421f92e451cdc1c8d3a46d908b9af7c0727ffba398a10b8067706c12af5ed6",
        "retrieved_at": "2026-10-08T19:14:10.623818Z"
      }
    },
    "maintenance": {
      "label": "Maintenance in self-service environments FAQ",
      "required": false,
      "article_url": "https://learn.microsoft.com/en-us/dynamics365/fin-ops-core/dev-itpro/deployment/plannedmaintenance-selfservice",
      "file_path": "articles/fin-ops-core/dev-itpro/deployment/plannedmaintenance-selfservice.md",
      "state": "current",
      "source": {
        "publisher": "Microsoft",
        "repository": "MicrosoftDocs/dynamics-365-unified-operations-public",
        "branch": "main",
        "file_path": "articles/fin-ops-core/dev-itpro/deployment/plannedmaintenance-selfservice.md",
        "commit": "d21e69eecf3c47e3a74d992d6e2032b6bd570bb4",
        "article_url": "https://learn.microsoft.com/en-us/dynamics365/fin-ops-core/dev-itpro/deployment/plannedmaintenance-selfservice",
        "raw_url": "https://raw.githubusercontent.com/MicrosoftDocs/dynamics-365-unified-operations-public/d21e69eecf3c47e3a74d992d6e2032b6bd570bb4/articles/fin-ops-core/dev-itpro/deployment/plannedmaintenance-selfservice.md",
        "markdown_date": "2026-04-02",
        "sha256": "42bd0d1421111af1816835a7f1a7c78028a84192e9be80de442462107855fc97",
        "retrieved_at": "2026-09-28T04:01:44.646801Z"
      }
    },
    "pqu_overview": {
      "label": "Proactive quality updates overview",
      "required": false,
      "article_url": "https://learn.microsoft.com/en-us/dynamics365/fin-ops-core/dev-itpro/get-started/quality-updates",
      "file_path": "articles/fin-ops-core/dev-itpro/get-started/quality-updates.md",
      "state": "current",
      "source": {
        "publisher": "Microsoft",
        "repository": "MicrosoftDocs/dynamics-365-unified-operations-public",
        "branch": "main",
        "file_path": "articles/fin-ops-core/dev-itpro/get-started/quality-updates.md",
        "commit": "d21e69eecf3c47e3a74d992d6e2032b6bd570bb4",
        "article_url": "https://learn.microsoft.com/en-us/dynamics365/fin-ops-core/dev-itpro/get-started/quality-updates",
        "raw_url": "https://raw.githubusercontent.com/MicrosoftDocs/dynamics-365-unified-operations-public/d21e69eecf3c47e3a74d992d6e2032b6bd570bb4/articles/fin-ops-core/dev-itpro/get-started/quality-updates.md",
        "markdown_date": "2026-03-26",
        "sha256": "c9bc5f7d1468ff3f96a9ab067b0db33cf13df8c699599ee2f05d152157ec33ed",
        "retrieved_at": "2026-09-28T04:01:44.646801Z"
      }
    },
    "pqu_faq": {
      "label": "Proactive quality updates FAQ",
      "required": false,
      "article_url": "https://learn.microsoft.com/en-us/dynamics365/fin-ops-core/dev-itpro/get-started/quality-updates-faq",
      "file_path": "articles/fin-ops-core/dev-itpro/get-started/quality-updates-faq.md",
      "state": "current",
      "source": {
        "publisher": "Microsoft",
        "repository": "MicrosoftDocs/dynamics-365-unified-operations-public",
        "branch": "main",
        "file_path": "articles/fin-ops-core/dev-itpro/get-started/quality-updates-faq.md",
        "commit": "d21e69eecf3c47e3a74d992d6e2032b6bd570bb4",
        "article_url": "https://learn.microsoft.com/en-us/dynamics365/fin-ops-core/dev-itpro/get-started/quality-updates-faq",
        "raw_url": "https://raw.githubusercontent.com/MicrosoftDocs/dynamics-365-unified-operations-public/d21e69eecf3c47e3a74d992d6e2032b6bd570bb4/articles/fin-ops-core/dev-itpro/get-started/quality-updates-faq.md",
        "markdown_date": "2026-08-10",
        "sha256": "666baea3e842976ad09e5869e6abb75df48863df193f1219069a69a070c98558",
        "retrieved_at": "2026-09-28T04:01:44.646801Z"
      }
    }
  },
  "links": {
    "repository": "https://github.com/0x8e8fb-p/d365-pqu-data",
    "pages": "https://0x8e8fb-p.github.io/d365-pqu-data/",
    "api_pqu": "https://0x8e8fb-p.github.io/d365-pqu-data/api/pqu.json",
    "api_csv": "https://0x8e8fb-p.github.io/d365-pqu-data/api/pqu.csv",
    "raw_pqu": "https://raw.githubusercontent.com/0x8e8fb-p/d365-pqu-data/main/data/pqu.json",
    "workbook": "https://0x8e8fb-p.github.io/d365-pqu-data/downloads/D365-PQU-Tracker.xlsx",
    "raw_workbook": "https://raw.githubusercontent.com/0x8e8fb-p/d365-pqu-data/main/excel/D365-PQU-Tracker.xlsx"
  }
}
